{
  "request_ref": "req_support_001",
  "case_ref": "case_existing_001",
  "account_ref": "acct_demo_001",
  "product_ref": "prod_core_platform",
  "prior_status_category": "open",
  "target_status_category": "pending_internal",
  "case_update_ref": "caseupd_support_001",
  "idempotency_ref": "idem_ticket_status_001",
  "approval_policy_ref": "policy_ticket_write_approval",
  "update_reason_category": "resolution_plan_ready"
}
